	Punto	Response	Simple
0	Intestazione: Settore, Servizio e Autorità che emana il provvedimento e tipo di provvedimento.	RISPOSTA GENERALE : NO, La determina non specifica il servizio di appartenenza presente nella macrostruttura vigente, limitandosi a indicare solo il Settore (Staff Segretario Generale) senza menzionare ulteriormente il servizio.	NO
1	Oggetto della determinazione	RISPOSTA GENERALE : SI, La determinazione riguarda l'affidamento diretto ai sensi dell'art. 50, comma 1, lett. b) del D.Lgs. n. 36/2023, con codice 15275, per il servizio di formazione sui controlli di regolarità amministrativa e aggiornamento del software AuditingPA.	SI
2	Indicazione del CIG, del CPV e del CUP (l’indicazione del CUI:  non è richiesta per gli affidamenti diretti ai sensi dell’art. 50 del Dlgs n.36/2023, in quanto consentiti per importi per i quali non è dovuto l’inserimento nei programmi triennali. È richiesta per affidamenti diretti ai sensi dell’art.76 del Dlgs n.36/2023. In caso di consegne complementari ex art.76, comma 4, let. B, o di ripetizione di lavori o servizi analoghi ex art. 76, comma 6, dovrà essere indicato il CUI dell’appalto principale del quale l’affidamento diretto risulta complementare o analogo)	RISPOSTA GENERALE: **SI**, il CIG è indicato nella determina e il CPV (80500000-9) è anch'esso presente, conforme alle disposizioni dell'art. 17, comma 2, del D.Lgs. n. 36/2023. Non è richiesto il CUP per questo tipo di affidamento diretto.	SI
3	Centro di Costo: si indica il centro di costo al quale imputare la spesa.	"RISPOSTA GENERALE : [SI], [Il centro di costo è specificato nella determina come ""1000000"" per l'impegno di spesa relativo alla formazione e aggiornamento del personale.]"	SI
4	Estremi decreto sindacale di nomina del Dirigente.	RISPOSTA GENERALE: **SI**, il Dirigente è stato nominato con il Decreto del Sindaco n. 18 del 26/06/2024, come indicato nella determina.	NO
5	Conflitto d’interessi	RISPOSTA GENERALE : SI, [La determina dichiara esplicitamente che nei confronti dei soggetti intervenuti alla procedura non sussistono situazioni di conflitto di interessi, in conformità a quanto stabilito dall'art. 16 del D.lgs. n. 36/2023.]	SI
6	Estremi della delega alla firma dell’atto, se persona diversa dal Dirigente.	RISPOSTA GENERALE: NO, non è presente la delega alla firma dell'atto. La determina è firmata dal Dirigente Maurizio Guadagno, ma non sono forniti gli estremi della delega nel caso in cui la firma fosse stata apposta da una persona diversa dal Dirigente stesso.	NO
7	Estremi atto di nomina del Responsabile unico del Progetto, se nominato.	RISPOSTA GENERALE: [SI], [Nel testo della determina è indicato che il Responsabile Unico del Progetto (RUP) è il Dott. Paolo Contu, come previsto dalle disposizioni di legge.]	SI
8	Normativa specifica:  Codice dei contratti pubblici (D.Lgs. n. 36.2023.) ;  L. R. n. 8/2018;  Art. 26 legge n.488/1999  Art. 1, D.L. 6 luglio 2012 n. 95 convertito dalla legge 7 agosto 2012 n. 135 (adesione convenzione Consip e MEPA);  Art. 1, comma 450, della legge 27 Dicembre 2006, n. 296 e ss.mm.ii. (per quanto applicabile);  Art. 26, della legge n. 488/1999 e ss.mm.ii.; DPCM 24 dicembre 2015 ;	RISPOSTA GENERALE : **SI**, la determina fa riferimento al Codice dei contratti pubblici (D.Lgs. n. 36/2023) e specifica l'uso del MEPA di Consip per l'affidamento diretto, in conformità con le normative citate, inclusi gli articoli 26 della legge n. 488/1999 e le disposizioni relative alle convenzioni Consip.	SI
9	Normativa generale:  TUEL;  Legge n. 241/90;  DPR n. 62/2013 Codice comportamento dipendenti pubblici;  L. n. 190/2012;  D.Lgs. n. 33/2013.  Legge n° 136/2010	RISPOSTA GENERALE : SI, [La determina fa riferimento a norme generali come il D.Lgs. n. 267/2000 (TUEL), la Legge n. 241/1990, il DPR n. 62/2013, la L. n. 190/2012, il D.Lgs. n. 33/2013 e la Legge n. 136/2010, che sono tutte correlate al processo amministrativo e alla gestione dei contratti pubblici, supportando la legittimità e la trasparenza dell'atto.]	SI
10	Norme di principio   Art. 4 del Dlgs n.36/2023. (Criterio interpretativo e applicativo)	RISPOSTA GENERALE: **NO**, la determina non fa esplicito riferimento all'art. 4 del D.lgs n. 36/2023, né ai principi di interpretazione e applicazione delle norme di principio, che sono fondamentali per l'esercizio della discrezionalità amministrativa e per la valutazione dei risultati ottenuti nella gestione dell'affidamento.	NO
11	Regolamenti dell’ente quali:  - Statuto Comunale;  - Regolamento di contabilità;  - Regolamento dei contratti	RISPOSTA GENERALE: NO, La determina non menziona esplicitamente lo Statuto Comunale, il Regolamento di contabilità e il Regolamento dei contratti dell'ente. La mancanza di riferimento a questi regolamenti può compromettere la regolarità amministrativa dell'atto.	NO
12	Indicazione dei riferimenti della determina a contrarre “semplificata” adottata	RISPOSTA GENERALE: **SI**, la determina a contrarre contiene in modo semplificato l'oggetto dell'affidamento, l'importo, il fornitore, le ragioni della scelta del fornitore e il possesso da parte sua dei requisiti di carattere generale.	SI
13	Indicazione dei riferimenti della determina a contrarre “non semplificata” adottata	"RISPOSTA GENERALE: NO, La determina non fa esplicito riferimento all'adozione di una determina a contrarre ""non semplificata"" con indicazione di numero e data, né sono forniti i termini entro i quali la procedura avrebbe dovuto concludersi."	NO
14	Elementi da approvare con la determina a contrarre nel caso di provvedimento unico	RISPOSTA GENERALE: NO, La determina non contiene l'indicazione dell'interesse pubblico che intende soddisfare l'amministrazione, né le caratteristiche specifiche dei servizi che si intendono acquistare. Questi elementi sono fondamentali per garantire la trasparenza e la legittimità dell'affidamento diretto.	NO
15	Per gli appalti di servizi: DUVRI	RISPOSTA GENERALE: **SI**, la determina riporta che, ai sensi dell'art. 26, comma 3 bis, del D. Lgs. 81/2008, non è necessario redigere il Documento Unico dei Rischi da Interferenze (DUVRI) in quanto si tratta di formazione on-line e aggiornamento del Software AuditingPA già in uso dall’ente. Pertanto, la quantificazione degli oneri pertinenti la sicurezza da rischio interferenziale risulta superflua.	SI
16	Suddivisione in lotti e norme sull’indebito frazionamento	RISPOSTA GENERALE : NO, La determina non contiene una motivazione esplicita per la mancata suddivisione dell'appalto in lotti, né si fa riferimento alle ragioni oggettive che giustificherebbero tale scelta in conformità all'art. 58 del D.Lgs. n. 36/2023.	NO
17	Validazione (in caso di lavori pubblici)	RISPOSTA GENERALE: NO, non è presente alcun riferimento agli estremi dell’avvenuta validazione del progetto posto a base di gara nella determina. La determina si occupa di un servizio di formazione e aggiornamento e non di lavori pubblici, pertanto non è applicabile il requisito della validazione del progetto.	NO
18	Criteri Ambientali Minimi (CAM)	RISPOSTA GENERALE: NO, non è specificato se i servizi di formazione e aggiornamento del Software AuditingPA rientrano nell'ambito di applicazione dei Criteri Ambientali Minimi (CAM) adottati in base alla normativa vigente. La determina non menziona i CAM né fa riferimento a un Piano per la sostenibilità ambientale dei consumi del settore della pubblica amministrazione.	NO
19	Cauzione	RISPOSTA GENERALE: **NO**, non è stata esplicitamente indicata la necessità di presentare la cauzione definitiva o la sua omissione nella determina. Manca la formula prevista dall’art. 117 del Dlgs n. 36/2023 riguardo all'obbligo di cauzione o alla sua non richiesta in relazione alla scarsa rilevanza economica dell'affidamento.	NO
20	Riferimenti all’obbligo di utilizzo di convenzioni Consip o di soggetti aggregatori	RISPOSTA GENERALE: SI, l'amministrazione ha verificato che non ci sono convenzioni attive relative alla fornitura oggetto del presente affidamento, come indicato nel testo della determina. La determina specifica che non risultano attive convenzioni Consip di cui all’art. 26, comma 1, della legge 488/1999 aventi ad oggetto la fornitura di servizi di formazione e aggiornamento, pertanto si è proceduto con l'affidamento diretto.	SI
21	Riferimenti all’obbligo di utilizzo del MEPA o del sistema telematico messo a disposizione dalla centrale regionale di riferimento	RISPOSTA GENERALE : SI, L'affidamento è stato effettuato tramite il Mercato Elettronico della Pubblica Amministrazione (MEPA) come indicato nella determina, rispettando così l'obbligo di utilizzo del sistema.	SI
22	Indicazioni in merito all’istruttoria propedeutica al provvedimento	RISPOSTA GENERALE: **NO**, l'istruttoria propedeutica al provvedimento non è adeguatamente documentata. Non risulta che il RUP abbia svolto indagini di mercato sufficienti o abbia interpellato più operatori economici per garantire la scelta dell'operatore idoneo, né ci sono evidenze di analisi dei prezzi o considerazioni sui preventivi ricevuti. La determina si limita a menzionare l'operatore selezionato senza giustificare in modo chiaro le modalità di scelta rispetto agli altri potenziali fornitori.	NO
23	Denominazione dell’operatore economico affidatario e indicazione relativa all’acquisizione dell’offerta	RISPOSTA GENERALE: **SI**, la determina riporta la denominazione dell'operatore economico affidatario (Fondazione PromoPA) e fa riferimento all'acquisizione dell'offerta tramite il Mercato Elettronico della Pubblica Amministrazione (MePA).	SI
24	Importo di affidamento	RISPOSTA GENERALE: NO, Non è stata fornita evidenza della congruità del costo della manodopera indicato in sede di presentazione del preventivo dall’affidatario, né dell'adeguatezza del contratto collettivo applicato in relazione alle tutele a favore dei lavoratori impiegati nell’appalto. La determina non menziona specificamente questi aspetti, che sono essenziali per la validità dell'affidamento diretto.	NO
25	Indicazione di requisiti previsti dalle disposizioni vigenti per il ricorso all’affidamento diretto.	RISPOSTA GENERALE : SI, L'operatore economico selezionato è stato individuato come in possesso di documentate esperienze pregresse idonee all’esecuzione delle prestazioni contrattuali, come indicato nella determina.	SI
26	Motivazione scelta della procedura e del contraente;        Esporre le ragioni della scelta della ditta affidataria;        Esposizione del fatto che legittima il ricorso alla procedura e della valutazione in ordine alla scelta del contraente.	RISPOSTA GENERALE: **SI**, la determina fornisce una motivazione adeguata per la scelta dell'affidatario. Viene infatti specificato che l'operatore economico ha fornito in precedenza forniture analoghe di ottimo livello, rispettando i tempi e la disciplina contrattuale. Inoltre, si sottolinea che il prezzo è competitivo rispetto alla media di mercato e si fa riferimento all'assenza di convenzioni attive per il tipo di servizio richiesto, giustificando così l'affidamento diretto.	SI
27	Motivazione scelta della procedura nel caso di ricorso all’art. 76, del Dlgs n.36/2023	RISPOSTA GENERALE : NO, La determina non fornisce una motivazione specifica del ricorso alla procedura ex art. 76 del Dlgs n. 36/2023, il che rappresenta una grave mancanza.	NO
28	Conformità dell’affidamento ai principi ed alle norme in materia di appalti pubblici	RISPOSTA GENERALE: **SI**, l'affidamento è conforme ai principi e alle norme in materia di appalti pubblici, come indicato nel testo della determina, che fa riferimento al rispetto dei principi di cui al Libro I, Parti I e II del Decreto legislativo 31 marzo 2023, n. 36.	SI
29	Dare atto della verifica dei requisiti dell’affidatario	RISPOSTA GENERALE : SI, La determina fa riferimento alla verifica dei requisiti di ordine generale e speciale dell'affidatario, in conformità con quanto previsto dal D.Lgs. 36/2023, specificando che sono state richieste le autocertificazioni necessarie e che la documentazione è stata acquisita e conservata agli atti dell'ufficio.	SI
30	Verifica sulla regolarità contributiva, DURC o attestazione della stessa o autocertificazione (limitata ai casi previsti dalla legge).	RISPOSTA GENERALE: **SI**, il Documento Unico di Regolarità Contributiva (DURC) dell'impresa è stato verificato e risulta regolare, come indicato nel testo della determina.	SI
31	Riferimenti alla deliberazione di approvazione del bilancio.	RISPOSTA GENERALE : NO, La determina non riporta gli estremi di approvazione del bilancio pluriennale vigente, né fa riferimento a una delibera specifica di bilancio.	NO
32	Riferimenti deliberazione approvazione PEG e al PIAO	RISPOSTA GENERALE: NO, La determina non fa riferimento esplicito alla deliberazione di approvazione del PEG e al Piano Integrato di Attività e Organizzazione (PIAO).	NO
33	Impegno di spesa/prenotazione	RISPOSTA GENERALE: SI, l'importo impegnato è di € 4.026,00, di cui € 3.050,00 esente IVA e € 976,00 assoggettato all'aliquota IVA del 22%. L'impegno di spesa è compatibile con i relativi stanziamenti di cassa e con le regole di finanza pubblica.	SI
34	Contributo ANAC	RISPOSTA GENERALE: NO, Non è menzionato alcun impegno di spesa relativo al pagamento del contributo all'ANAC nella determina, pertanto non rispetta il requisito previsto per affidamenti di importo pari o superiore ad € 40.000,00.	NO
35	Flussi finanziari	RISPOSTA GENERALE : NO, La determina non contiene alcun riferimento all'obbligo di tracciabilità dei flussi finanziari ai sensi della legge n° 136/2010, né specifica le conseguenze in caso di mancato adempimento.	NO
36	Conformità dei pagamenti con le regole della finanza pubblica vigenti	RISPOSTA GENERALE: **SI**, il provvedimento di impegno attesta che il programma dei pagamenti è compatibile con i relativi stanziamenti di cassa e con le regole di finanza pubblica, ai sensi dell'art. 183, comma 8, del D.Lgs. n. 267/2000.	SI
37	Indicazione esatta dell’aggiudicatario: nome, cognome, ragione sociale, indirizzo, P.Iva, Cod. Fiscale, sede legale/operativa, altro.	RISPOSTA GENERALE : SI, La determina indica chiaramente l'aggiudicatario, la Fondazione PromoPA, fornendo il nome, l'indirizzo, la P.Iva e il Codice Fiscale, come richiesto.	SI
38	Comunicazione all’aggiudicatario dell’impegno di spesa, la copertura finanziaria, CIG	RISPOSTA GENERALE: **NO**, la determina non contiene informazioni relative all'impegno di spesa, alla copertura finanziaria e al CIG in modo dettagliato, come richiesto dall'art. 191, del D.Lgs. n. 267/2000. Non è specificato il numero della determina, il Settore, il CIG e il codice univoco dell'Ente, elementi necessari per la corretta emissione della fattura da parte dell'aggiudicatario.	NO
39	Indicazione specifica della tipologia del contratto	"RISPOSTA GENERALE : SI, La determina indica specificamente la tipologia del contratto come ""Formazione ed aggiornamento del personale"" riguardo ai ""Controlli di regolarità Amministrativa in materia di contratti pubblici"" e l'oggetto del contratto è chiaramente delineato."	SI
40	Obblighi di pubblicità e trasparenza	RISPOSTA GENERALE: **SI**, la determina fa riferimento agli obblighi di trasparenza previsti dagli articoli 20 e 28 del Codice dei contratti e dal D.Lgs. n. 33/2013, indicando che tutti gli atti della procedura di gara sono soggetti a tali obblighi.	SI
41	Attestazione circa il rispetto delle prescrizioni del   PTPCT dell’Ente	RISPOSTA GENERALE : **NO**, non è presente un esplicito riferimento al rispetto delle prescrizioni del PTPCT (Piano Triennale di Prevenzione della Corruzione e della Trasparenza) dell’Ente nella determina. Non sono menzionati i punti relativi al patto d’integrità, alle misure generali previste dal Piano, né alle prescrizioni specifiche degli artt. 6, 7 e 14 del DPR n. 62/2013 riguardanti il conflitto di interessi e il codice di comportamento integrativo.	NO
42	Pubblicazione atti all’Albo Pretorio Online.	RISPOSTA GENERALE : SI, [La determina prevede la pubblicazione della presente determinazione dirigenziale secondo i tempi e le modalità di cui all’art. 12 del regolamento comunale per l’attuazione dei controlli di regolarità amministrativa, quindi è rispettata la prescrizione.]	SI
43	Indicazione termini e autorità a cui ricorrere	RISPOSTA GENERALE : SI, [La determina indica che avverso il presente provvedimento è ammesso ricorso giurisdizionale innanzi al TAR Sardegna, come previsto dall’art. 120 del D.Lgs. 104/2010, quindi i termini e le modalità di ricorso sono rispettati.]	SI
44	Sottoscrizione del Dirigente firmatario dell’atto e, dove previsto, del RP o RUP.	RISPOSTA GENERALE: **SI**, la determina è firmata digitalmente dal Dirigente Maurizio Guadagno e dal RUP Dott. Paolo Contu, rispettando così le disposizioni relative alla sottoscrizione degli atti.	SI
45	Presenza del visto di regolarità contabile	RISPOSTA GENERALE: NO, La determina non riporta esplicitamente la presenza del visto di regolarità contabile, ma menziona che sarà trasmessa al servizio finanziario per l'acquisizione del visto. Questo implica che il visto non è ancora stato ottenuto al momento della redazione della determina.	NO
