	Punto	Response	Simple
0	Intestazione: Settore, Servizio e Autorità che emana il provvedimento e tipo di provvedimento.	"RISPOSTA: NO

Note: Nella determina non è indicato il servizio di appartenenza presente nella macrostruttura vigente."	NO
1	Oggetto della determinazione	RISPOSTA : NO (Il codice corretto dell'oggetto deve essere 15275, non 15271. La norma attributiva del potere ex art. 50, comma 1, lett. a) del Dlgs n. 36/2023 è citata, ma l'oggetto presenta un errore nel codice)	NO
2	Indicazione del CIG, del CPV e del CUP (l’indicazione del CUI:  non è richiesta per gli affidamenti diretti ai sensi dell’art. 50 del Dlgs n.36/2023, in quanto consentiti per importi per i quali non è dovuto l’inserimento nei programmi triennali. È richiesta per affidamenti diretti ai sensi dell’art.76 del Dlgs n.36/2023. In caso di consegne complementari ex art.76, comma 4, let. B, o di ripetizione di lavori o servizi analoghi ex art. 76, comma 6, dovrà essere indicato il CUI dell’appalto principale del quale l’affidamento diretto risulta complementare o analogo)	"RISPOSTA: NO 

Note: Non sono presenti indicazioni del CPV nella determina."	NO
3	Centro di Costo: si indica il centro di costo al quale imputare la spesa.	"RISPOSTA: NO

Note: Non è presente il riferimento esplicito al centro di costo nel testo della determina."	NO
4	Estremi decreto sindacale di nomina del Dirigente.	"RISPOSTA: NO

Note: Nel testo della determina non sono presenti estremi del decreto sindacale di nomina del dirigente."	NO
5	Conflitto d’interessi	RISPOSTA : SI	SI
6	Estremi della delega alla firma dell’atto, se persona diversa dal Dirigente.	RISPOSTA: NO	NO
7	Estremi atto di nomina del Responsabile unico del Progetto, se nominato.	"RISPOSTA: NO

Note: Non si trovano riferimenti all'atto di nomina del Responsabile unico del Progetto nel testo della determina."	NO
8	Normativa specifica:  Codice dei contratti pubblici (D.Lgs. n. 36.2023.) ;  L. R. n. 8/2018;  Art. 26 legge n.488/1999  Art. 1, D.L. 6 luglio 2012 n. 95 convertito dalla legge 7 agosto 2012 n. 135 (adesione convenzione Consip e MEPA);  Art. 1, comma 450, della legge 27 Dicembre 2006, n. 296 e ss.mm.ii. (per quanto applicabile);  Art. 26, della legge n. 488/1999 e ss.mm.ii.; DPCM 24 dicembre 2015 ;	RISPOSTA: SI	SI
9	Normativa generale:  TUEL;  Legge n. 241/90;  DPR n. 62/2013 Codice comportamento dipendenti pubblici;  L. n. 190/2012;  D.Lgs. n. 33/2013.  Legge n° 136/2010	RISPOSTA: SI	SI
10	Norme di principio   Art. 4 del Dlgs n.36/2023. (Criterio interpretativo e applicativo)	RISPOSTA: SI	SI
11	Regolamenti dell’ente quali:  - Statuto Comunale;  - Regolamento di contabilità;  - Regolamento dei contratti	"RISPOSTA: YES

Note: La determina fa riferimento al ""Regolamento di contabilità dell’Ente"", ma non menziona esplicitamente lo Statuto Comunale o il Regolamento dei contratti. Tuttavia, nel contesto della regolarità amministrativa, il riferimento al Regolamento di contabilità implica una considerazione generale della normativa interna, che potrebbe includere anche i regolamenti citati."	Not found
12	Indicazione dei riferimenti della determina a contrarre “semplificata” adottata	"RISPOSTA: NO

Note: Non risulta essere presente una determina a contrarre o atto equivalente che indichi in modo semplificato l'oggetto dell'affidamento, l'importo, il fornitore, le ragioni della scelta del fornitore, nonché il possesso da parte sua dei requisiti."	NO
13	Indicazione dei riferimenti della determina a contrarre “non semplificata” adottata	"RISPOSTA: NO

Note: Non è presente un riferimento esplicito alla determina a contrarre ""non semplificata"", né i termini entro cui la procedura avrebbe dovuto concludersi."	NO
14	Elementi da approvare con la determina a contrarre nel caso di provvedimento unico	"RISPOSTA: NO

Note: Non sono presenti esplicitatamente indicazioni riguardanti l'interesse pubblico, le caratteristiche delle opere o il progetto esecutivo completo."	NO
15	Per gli appalti di servizi: DUVRI	"RISPOSTA: NO

Note: Non è menzionato alcun DUVRI o attestazione del progettista nel testo della determina."	NO
16	Suddivisione in lotti e norme sull’indebito frazionamento	"RISPOSTA: NO

Note: Non è presente nel testo della determina la motivazione riguardante la mancata suddivisione dell'appalto in lotti secondo quanto richiesto dall'art. 58 del D.lgs. n. 36/2023."	NO
17	Validazione (in caso di lavori pubblici)	"RISPOSTA : NO 

Note: La determina non riporta gli estremi dell’avvenuta validazione del progetto posto a base di gara."	NO
18	Criteri Ambientali Minimi (CAM)	RISPOSTA: NO	NO
19	Cauzione	NO	NO
20	Riferimenti all’obbligo di utilizzo di convenzioni Consip o di soggetti aggregatori	"RISPOSTA: NO

Note: Nella determina non sono presenti riferimenti all'adesione a convenzioni Consip o di altro soggetto aggregatore, né si giustifica la mancata adesione a tali convenzioni."	NO
21	Riferimenti all’obbligo di utilizzo del MEPA o del sistema telematico messo a disposizione dalla centrale regionale di riferimento	RISPOSTA : NO	NO
22	Indicazioni in merito all’istruttoria propedeutica al provvedimento	"RISPOSTA: NO 

Note: La determina non presenta elementi specifici riguardanti le modalità di istruttoria propedeutiche al provvedimento, come richiesto."	NO
23	Denominazione dell’operatore economico affidatario e indicazione relativa all’acquisizione dell’offerta	RISPOSTA: SI	SI
24	Importo di affidamento	"RISPOSTA : NO

Note: Nella determina non si fa menzione riguardo alla congruità del costo della manodopera, al contratto collettivo di lavoro applicato e ad eventuali oneri della sicurezza."	NO
25	Indicazione di requisiti previsti dalle disposizioni vigenti per il ricorso all’affidamento diretto.	RISPOSTA: SI	SI
26	Motivazione scelta della procedura e del contraente;        Esporre le ragioni della scelta della ditta affidataria;        Esposizione del fatto che legittima il ricorso alla procedura e della valutazione in ordine alla scelta del contraente.	"RISPOSTA : NO

Note: Non risulta presente una motivazione dettagliata che giustifichi la scelta dell’affidatario in relazione ai requisiti previsti dall’art. 50 del D.Lgs. n. 36/2023 e agli altri criteri indicati."	NO
27	Motivazione scelta della procedura nel caso di ricorso all’art. 76, del Dlgs n.36/2023	RISPOSTA : NO	NO
28	Conformità dell’affidamento ai principi ed alle norme in materia di appalti pubblici	RISPOSTA : SI	SI
29	Dare atto della verifica dei requisiti dell’affidatario	RISPOSTA: SI	SI
30	Verifica sulla regolarità contributiva, DURC o attestazione della stessa o autocertificazione (limitata ai casi previsti dalla legge).	"RISPOSTA: NO

Note: Non è menzionata la presenza di un Documento di Regolarità Contributiva (DURC) o attestazione di regolarità contributiva nel testo della determina."	NO
31	Riferimenti alla deliberazione di approvazione del bilancio.	"RISPOSTA: NO

Nota: Nella determina si fa riferimento solo a deliberazioni del Consiglio Comunale e della Giunta Comunale riguardanti il bilancio di previsione e non a una deliberazione di approvazione specifica del bilancio pluriennale."	NO
32	Riferimenti deliberazione approvazione PEG e al PIAO	RISPOSTA : NO	NO
33	Impegno di spesa/prenotazione	"RISPOSTA : NO

Note: Non ci sono riferimenti espliciti su impegni di spesa o prenotazioni. Non è specificato se l'importo è assoggettato a IVA né è indicato se il bilancio e il PEG siano stati approvati, né se si tratta di impegni pluriennali."	NO
34	Contributo ANAC	"RISPOSTA : NO 

Note: La determina riguarda un affidamento di importo inferiore a € 40.000,00 e quindi non si applica l'obbligo di pagamento del contributo all'ANAC."	NO
35	Flussi finanziari	"RISPOSTA: NO

Note: La determina non fa menzione dell'obbligo di tracciabilità dei flussi finanziari ai sensi della legge n° 136/2010."	NO
36	Conformità dei pagamenti con le regole della finanza pubblica vigenti	"RISPOSTA : NO

Note: Non risulta esplicitamente dichiarato nel provvedimento che il programma della spesa derivante dall’atto è compatibile con le vigenti regole della finanza pubblica."	NO
37	Indicazione esatta dell’aggiudicatario: nome, cognome, ragione sociale, indirizzo, P.Iva, Cod. Fiscale, sede legale/operativa, altro.	RISPOSTA: SI	SI
38	Comunicazione all’aggiudicatario dell’impegno di spesa, la copertura finanziaria, CIG	RISPOSTA: SI	SI
39	Indicazione specifica della tipologia del contratto	RISPOSTA : SI	SI
40	Obblighi di pubblicità e trasparenza	RISPOSTA: SI	SI
41	Attestazione circa il rispetto delle prescrizioni del   PTPCT dell’Ente	"RISPOSTA: NO 

Note: Non è presente l'attestazione circa il rispetto delle prescrizioni del PTPCT dell'Ente nella determina."	NO
42	Pubblicazione atti all’Albo Pretorio Online.	RISPOSTA : SI	SI
43	Indicazione termini e autorità a cui ricorrere	RISPOSTA : SI	SI
44	Sottoscrizione del Dirigente firmatario dell’atto e, dove previsto, del RP o RUP.	"RISPOSTA: NO

Note: Nel testo della determina non è presente la firma del Dirigente firmatario dell'atto né del RUP, il che costituisce una grave mancanza di regolarità formale."	NO
45	Presenza del visto di regolarità contabile	"RISPOSTA : NO

Nota: Nella determina non è presente il visto di regolarità contabile, sebbene sia accennato che il provvedimento deve essere trasmesso al servizio finanziario per i necessari provvedimenti."	NO
